{
  "gate_id": "ORCH-PROD-001",
  "capacity": 1,
  "automatic_retries": false,
  "public_release": false,
  "tasks": [
    {
      "sequence": 1,
      "target_id": "OR-PB03-001",
      "county": "Baker County",
      "geoid": "41001",
      "ocdid": "ocd-division/country:us/state:or/county:baker",
      "pr": 458,
      "base_sha": "6f4ba1bf1a2f0696a8ee1f5ee1fcb277051d767b",
      "head_sha": "cd747bcabbabd0f43edb0d7dbce3759f6339b1e3",
      "merge_sha": "8502b213ffba2e910d71d2747bacb6293d36bff2",
      "workflow_run_id": 31989075122,
      "job_id": 95269155928,
      "status": "PASS",
      "production_run_id": "147bf699bde562f4a6c1",
      "artifact_id": 9274712567,
      "artifact_sha256": "17dc286c0b6a5bd0858188721f33fc1b866f14dde04ff8a8ac5f340e01cfe794",
      "production_acceptance": true,
      "deterministic": true,
      "nesting_parity": true,
      "enrichment_guard": true
    },
    {
      "sequence": 2,
      "target_id": "OR-PB03-002",
      "county": "Benton County",
      "geoid": "41003",
      "ocdid": "ocd-division/country:us/state:or/county:benton",
      "pr": 459,
      "base_sha": "8502b213ffba2e910d71d2747bacb6293d36bff2",
      "head_sha": "510c3ec3ac562c13aaa0b650f2138193dbe0fcf5",
      "merge_sha": "3ed5e64e5bc8a3b117b6e04f63d6f71ce1e2e657",
      "workflow_run_id": 31992029955,
      "job_id": 95277173414,
      "status": "PASS",
      "production_run_id": "ef7b94f40587e24bf517",
      "artifact_id": 9275649916,
      "artifact_sha256": "28cfe25843e58622b1e6dafc919367ab0d85da3d633aeede095200bc3cbd49a6",
      "production_acceptance": true,
      "deterministic": true,
      "nesting_parity": true,
      "enrichment_guard": true
    },
    {
      "sequence": 3,
      "target_id": "OR-PB03-003",
      "county": "Clackamas County",
      "geoid": "41005",
      "ocdid": "ocd-division/country:us/state:or/county:clackamas",
      "pr": 460,
      "base_sha": "3ed5e64e5bc8a3b117b6e04f63d6f71ce1e2e657",
      "head_sha": "0920b4348c5d111b899b0571af8fcdf178a2093c",
      "merge_sha": "664e244ecf6aeb17f84e0963142ad66ba8ebcbf7",
      "workflow_run_id": 31992370600,
      "job_id": 95278072027,
      "status": "PASS",
      "production_run_id": "6b55416ff61f70ae2ed8",
      "artifact_id": 9275757035,
      "artifact_sha256": "6c3fb7a59d4e1a44584f56c6fea99a986d580bfd8c103b4b2cd9e9f6226b4287",
      "production_acceptance": true,
      "deterministic": true,
      "nesting_parity": true,
      "enrichment_guard": true
    }
  ]
}
